{
  "address": "http://localhost:8080/HelloService",
  "implementor": "com.example.HelloServiceImpl",
  "wsdlLocation": "classpath:wsdl/hello.wsdl",
  "serviceName": "{http://example.com}HelloService",
  "endpointName": "{http://example.com}HelloPort",
  "inInterceptors": [
    "org.apache.cxf.ws.security.wss4j.WSS4JInInterceptor"
  ],
  "outInterceptors": [
    "org.apache.cxf.ws.security.wss4j.WSS4JOutInterceptor"
  ]
}